200,Cardig Aero Services Tbk,CASS,J111,Infrastructures,Transportation Infrastructure,Transport Infrastructure Operator,Airport Operators,"COMPOSITE, IDXINFRA, IDXSMC-COM, ISSI, MBX",12.71,2.90,22.83,16.23,0.41,6010416000000,2373275000000,1.79,10.89,31.94,57.02,19.92,0.00,51.60
201,PT Bangun Kosambi Sukses Tbk,CBDK,H111,Properties & Real Estate,Properties & Real Estate,Real Estate Management & Development,Real Estate Development & Management,"COMPOSITE, IDXPROPERT, ISSI, MBX",28.79,3.70,12.85,6.98,0.84,44359490712500,2298139383000,36.69,40.08,34.52,,67.04,-0.59,
202,Cahaya Bintang Medan Tbk,CBMF,E211,Consumer Cyclicals,Household Goods,Household Goods,Home Furnishings,"COMPOSITE, IDXCYCLIC",,0.39,-5.80,-3.88,0.50,93750000000,3068826734,0.00,0.00,0.00,0.00,-450.11,0.00,0.00
203,PT Citra Buana Prasida Tbk,CBPE,H111,Properties & Real Estate,Properties & Real Estate,Real Estate Management & Development,Real Estate Development & Management,"COMPOSITE, DBX, IDXPROPERT, ISSI",10.50,1.52,14.49,12.48,0.16,466550000000,58863547727,16.06,68.25,65.63,32.50,75.49,-2.45,65.63
204,PT Cakra Buana Resources Energi Tbk,CBRE,A122,Energy,"Oil, Gas & Coal",Coal,Coal Distribution,"COMPOSITE, DBX, IDXENERGY, ISSI",-70.47,57.76,-81.97,-19.69,3.16,4787661150255,25031467154,-6.06,75.00,1273.42,5927.78,-271.43,6.37,5610.53
205,PT Citra Borneo Utama Tbk,CBUT,D232,Consumer Non-Cyclicals,Food & Beverage,Agricultural Products,Plantations & Crops,"COMPOSITE, DBX, IDXNONCYC, IDXSMC-COM",42.55,4.01,9.42,2.59,2.64,4250000000000,10308260000000,-3.08,-23.17,-11.89,16.67,0.97,-4.91,32.63
206,Communication Cable Systems Indonesia Tbk,CCSI,C131,Industrials,Industrial Goods,Electrical,Electrical Components & Equipment,"COMPOSITE, DBX, IDXINDUST, ISSI",122.71,0.93,0.76,0.54,0.40,450666665878,208203877000,-2.30,-16.26,-2.86,45.30,1.76,0.59,19.72
207,PT Chandra Daya Investasi Tbk,CDIA,J411,Infrastructures,Utilities,Electric Utilities,Electric Utilities,"COMPOSITE, DBX, IDXINFRA",163.94,12.55,7.65,5.50,0.39,240920693171000,1749714579756,-0.80,34.06,,,83.99,-3.65,
208,Wilmar Cahaya Indonesia Tbk,CEKA,D222,Consumer Non-Cyclicals,Food & Beverage,Processed Foods,Processed Foods,"COMPOSITE, DBX, IDXNONCYC, IDXSMC-COM, ISSI",5.57,0.75,13.48,10.58,0.27,1487500000000,7003973096308,-2.80,-8.65,-17.35,19.12,3.81,-2.41,14.08
209,PT Centratama Telekomunikasi Indonesia Tbk.,CENT,J321,Infrastructures,Telecommunication,Wireless Telecommunication Services,Wireless Telecommunication Services,"COMPOSITE, DBX, IDXINFRA, IDXSMC-COM",-1.99,1.64,-82.34,-8.99,8.16,4895803989300,1884532000000,7.53,33.05,63.54,241.30,-130.60,0.00,241.30
210,Clipan Finance Indonesia Tbk,CFIN,G211,Financials,Financing Service,Consumer Financing,Consumer Financing,"COMPOSITE, IDXFINANCE, IDXSMC-COM, MBX",6.93,0.23,3.33,1.95,0.71,1314891750810,992556641000,-0.62,0.63,-3.59,-6.40,19.12,-0.62,3.21
211,PT Citra Nusantara Gemilang Tbk.,CGAS,A112,Energy,"Oil, Gas & Coal",Oil & Gas,Oil & Gas Storage & Distribution,"COMPOSITE, DBX, IDXENERGY, ISSI",32.31,1.13,3.51,2.42,0.45,308240832786,426655447643,21.25,31.97,108.60,88.35,2.24,9.60,88.35
212,PT Diastika Biotekindo Tbk,CHEK,F112,Healthcare,Healthcare Equipment & Providers,Healthcare Equipment & Supplies,Healthcare Supplies & Distributions,"COMPOSITE, DBX, IDXHEALTH, ISSI",38.12,3.60,9.45,7.89,0.20,760966324725,131742897454,-5.95,-13.86,,,15.15,-4.92,
213,PT Chemstar Indonesia Tbk,CHEM,B111,Basic Materials,Basic Materials,Chemicals,Basic Chemicals,"COMPOSITE, DBX, IDXBASIC, ISSI",553.37,1.59,0.29,0.18,0.60,185301590746,161723435102,-8.04,10.75,90.74,49.28,0.21,-4.63,63.49
214,PT Pelita Teknologi Global Tbk,CHIP,I231,Technology,Technology Hardware & Equipment,"Electronic Equipment, Instruments & Components",Electronic Equipment & Instruments,ABX,237.36,15.57,6.56,3.61,0.82,1120340000000,98593954557,-5.76,-6.76,-2.24,-20.61,4.79,-6.09,-11.49
215,Chitose Internasional Tbk,CINT,E211,Consumer Cyclicals,Household Goods,Household Goods,Home Furnishings,"COMPOSITE, DBX, IDXCYCLIC, ISSI",11.08,0.70,6.33,4.09,0.55,212000000000,324293008653,1.58,22.93,12.87,-8.96,5.90,-6.31,4.32
216,Cita Mineral Investindo Tbk,CITA,B141,Basic Materials,Basic Materials,Metals & Minerals,Aluminum,"COMPOSITE, IDXBASIC, IDXSMC-COM, ISSI, MBX",5.50,1.95,35.41,34.03,0.04,16356291962500,2074682305669,-5.82,2.68,5.25,17.27,143.22,2.18,16.94
217,Natura City Developments Tbk,CITY,H111,Properties & Real Estate,Properties & Real Estate,Real Estate Management & Development,Real Estate Development & Management,"COMPOSITE, DBX, IDXPROPERT, ISSI",58.40,1.11,1.90,1.57,0.21,972934013880,104758572243,173.37,327.78,407.69,255.38,15.90,158.10,308.85
218,Citra Putra Realty Tbk,CLAY,E512,Consumer Cyclicals,Consumer Services,Tourism & Recreation,"Hotels, Resorts & Cruise Lines","COMPOSITE, DBX, IDXCYCLIC, IDXSMC-COM",-974.72,691.02,-70.89,-1.28,54.59,6861900000000,103575023423,-3.64,69.87,166.33,896.24,-6.80,0.00,896.24
219,Sariguna Primatirta Tbk,CLEO,D212,Consumer Non-Cyclicals,Food & Beverage,Beverages,Soft Drinks,"COMPOSITE, IDXNONCYC, IDXSMC-COM, ISSI, KOMPAS100, MBX",27.59,5.44,19.72,14.67,0.34,12120000000000,2093224845779,-8.19,-5.49,-30.65,-63.62,20.99,-4.55,-67.43
220,Colorpak Indonesia Tbk,CLPI,B113,Basic Materials,Basic Materials,Chemicals,Specialty Chemicals,"COMPOSITE, DBX, IDXBASIC, ISSI",7.12,0.81,11.33,7.99,0.42,467166212500,714085690810,3.44,20.40,16.22,41.98,9.19,-0.99,44.02
221,Citra Marga Nusaphala Persada Tbk,CMNP,J112,Infrastructures,Transportation Infrastructure,Transport Infrastructure Operator,Highways & Railtracks,"COMPOSITE, IDXINFRA, IDXSMC-COM, ISSI, MBX",10.36,0.58,5.59,3.56,0.57,9040078427850,3404530101000,-2.22,-2.58,-0.75,-6.05,25.62,-0.75,-5.71
222,Cemindo Gemilang Tbk,CMNT,B121,Basic Materials,Basic Materials,Construction Materials,Construction Materials,"COMPOSITE, DBX, IDXBASIC, IDXSMC-COM",-18.27,4.54,-24.82,-4.30,4.77,13272265600000,6429311000000,-1.95,-7.93,-14.20,-24.50,-11.30,-1.31,-20.11
223,AirAsia Indonesia Tbk,CMPP,K111,Transportation & Logistic,Transportation,Airlines,Airlines,"COMPOSITE, IDXTRANS, ISSI",-0.49,-0.09,,-33.80,-1.54,940290950808,6028755514712,11.11,12.36,25.00,31.58,-31.75,9.89,16.28
224,Cisarua Mountain Dairy Tbk,CMRY,D221,Consumer Non-Cyclicals,Food & Beverage,Processed Foods,Dairy Products,"COMPOSITE, ESGQKEHATI, ESGSKEHATI, IDX80, IDXESGL, IDXNONCYC, IDXQ30, IDXSMC-COM, IDXSMC-LIQ, ISSI, JII70, KOMPAS100, MBX, MNC36",25.04,6.87,27.43,22.01,0.25,49195034600000,7873254000000,-8.43,18.75,16.80,9.62,24.95,0.88,15.85
225,Exploitasi Energi Indonesia Tbk,CNKO,A122,Energy,"Oil, Gas & Coal",Coal,Coal Distribution,"COMPOSITE, IDXENERGY",3.20,-0.52,,17.60,-1.93,582163478390,1460506290000,8.20,-30.53,94.12,407.69,12.46,-1.49,175.00
226,PT Nusantara Sejahtera Raya Tbk,CNMA,E514,Consumer Cyclicals,Consumer Services,Tourism & Recreation,Recreational & Sports Facilities,"COMPOSITE, DBX, IDXCYCLIC, IDXSMC-COM, ISSI",15.14,2.17,14.32,9.48,0.51,9751365000000,4290870000000,2.61,-9.23,-24.84,-34.44,15.01,-4.84,-35.87
227,Century Textile Industry (Seri B) Tbk.,CNTB,,No Sector,No Subsector,,,,-0.23,-0.06,,-30.83,-1.83,32500000000,194487188532,0.00,0.00,0.00,0.00,-71.41,0.00,0.00
228,Centex Tbk,CNTX,E413,Consumer Cyclicals,Apparel & Luxury Goods,Apparel & Luxury Goods,Textiles,"COMPOSITE, IDXCYCLIC",-0.07,-0.02,,-30.83,-1.83,9940000000,194487188532,0.00,0.00,0.00,0.00,-71.41,0.00,0.00
229,PT Black Diamond Resources Tbk,COAL,A121,Energy,"Oil, Gas & Coal",Coal,Coal Production,"COMPOSITE, DBX, IDXENERGY, ISSI",23.84,1.32,5.53,2.54,1.18,518750000000,241318670295,103.17,156.00,228.21,245.95,9.02,14.29,166.67
230,Wahana Interfood Nusantara Tbk,COCO,D222,Consumer Non-Cyclicals,Food & Beverage,Processed Foods,Processed Foods,"COMPOSITE, DBX, IDXNONCYC",-12.30,-316.46,,-30.63,-84.99,1423782369600,111457612368,-10.14,-25.60,57.63,332.56,-103.85,-5.58,359.26
231,PT Indokripto Koin Semesta Tbk,COIN,G511,Financials,Holding & Investment Companies,Holding & Investment Companies,Financial Holdings,"COMPOSITE, DBX, IDXFINANCE",572.81,34.10,5.95,5.78,0.03,52500000168000,204633223863,23.19,80.97,,,44.79,11.14,
232,Cowell Development Tbk,COWL,H111,Properties & Real Estate,Properties & Real Estate,Real Estate Management & Development,Real Estate Development & Management,"COMPOSITE, IDXPROPERT",,-12.63,,-37.63,-133.29,243560701050,461082871379,0.00,0.00,0.00,0.00,-208.17,0.00,0.00
233,Charoen Pokphand Indonesia Tbk,CPIN,D231,Consumer Non-Cyclicals,Food & Beverage,Agricultural Products,"Fish, Meat, & Poultry","COMPOSITE, IDX30, IDX80, IDXLQ45LCL, IDXNONCYC, IDXQ30, IDXVESTA28, Investor33, ISSI, JII, JII70, KOMPAS100, LQ45, MBX",16.18,2.38,14.70,10.73,0.37,75922740000000,50604542000000,-6.09,-4.49,-10.06,-9.70,9.27,-5.10,-7.07
234,Capri Nusa Satu Properti Tbk,CPRI,H111,Properties & Real Estate,Properties & Real Estate,Real Estate Management & Development,Real Estate Development & Management,"COMPOSITE, IDXPROPERT",,0.66,-2.00,-1.75,0.14,121668997900,2886739228,0.00,0.00,0.00,0.00,-127.14,0.00,0.00
235,Central Proteina Prima Tbk,CPRO,D231,Consumer Non-Cyclicals,Food & Beverage,Agricultural Products,"Fish, Meat, & Poultry","COMPOSITE, DBX, IDXNONCYC, IDXSMC-COM, ISSI",9.58,0.97,10.12,5.70,0.78,3872204881155,7336307000000,-4.69,7.02,19.61,22.00,5.51,-4.69,22.00
236,PT Toba Surimi Industries Tbk,CRAB,D231,Consumer Non-Cyclicals,Food & Beverage,Agricultural Products,"Fish, Meat, & Poultry","COMPOSITE, DBX, IDXNONCYC, ISSI",18.38,2.38,12.94,8.94,0.45,546000000000,455329844984,-7.09,7.38,9.17,0.00,6.52,-5.76,-0.76
237,PT Carsurin Tbk,CRSN,C232,Industrials,Industrial Services,Professional Services,Research & Consulting Services,"COMPOSITE, DBX, IDXINDUST, ISSI",25.47,1.71,6.70,4.07,0.64,390420000000,352127777110,10.08,22.43,19.09,33.67,4.35,-1.50,14.91
238,Catur Sentosa Adiprana Tbk,CSAP,E743,Consumer Cyclicals,Retailing,Specialty Retail,Home Improvement Retail,"COMPOSITE, DBX, IDXCYCLIC, IDXSMC-COM, ISSI",15.31,0.50,3.28,1.01,2.24,1852715099226,12862079691000,-2.40,10.88,25.38,-27.56,0.94,-1.21,-28.19
239,Cahayasakti Investindo Sukses Tbk,CSIS,H111,Properties & Real Estate,Properties & Real Estate,Real Estate Management & Development,Real Estate Development & Management,"COMPOSITE, DBX, IDXPROPERT, ISSI",66.10,1.55,2.35,1.59,0.48,551554000000,69412694305,29.70,242.40,568.75,455.84,12.02,9.74,502.82
240,Cipta Selera Murni Tbk,CSMI,E515,Consumer Cyclicals,Consumer Services,Tourism & Recreation,Restaurants,"COMPOSITE, DBX, IDXCYCLIC, ISSI",-62.11,47.67,-76.76,-6.75,10.38,208911744000,1413309177,-30.38,-38.89,-87.95,-92.72,-238.00,-5.17,-92.74
241,PT Cisadane Sawit Raya Tbk.,CSRA,D232,Consumer Non-Cyclicals,Food & Beverage,Agricultural Products,Plantations & Crops,"COMPOSITE, IDXNONCYC, IDXSMC-COM, ISSI, MBX",6.05,1.22,20.22,11.99,0.69,1834750000000,1334652207155,-2.81,2.37,38.40,17.69,22.73,-3.89,18.49
242,Citra Tubindo Tbk,CTBN,B144,Basic Materials,Basic Materials,Metals & Minerals,Iron & Steel,"COMPOSITE, DBX, IDXBASIC, IDXSMC-COM, ISSI",12.16,2.95,24.24,16.99,0.43,6082823400000,3650536978140,18.40,22.44,17.29,124.11,13.70,-27.03,124.11
243,Ciputra Development Tbk,CTRA,H111,Properties & Real Estate,Properties & Real Estate,Real Estate Management & Development,Real Estate Development & Management,"COMPOSITE, ECONOMIC30, ESGQKEHATI, ESGSKEHATI, IDX80, IDXESGL, IDXG30, IDXLQ45LCL, IDXPROPERT, IDXSHAGROW, IDXSMC-COM, IDXSMC-LIQ, IDXV30, IDXVESTA28, ISSI, JII70, KOMPAS100, LQ45, MBX, MNC36",6.53,0.62,9.56,5.35,0.79,16126054871850,8391803000000,-2.30,-11.46,-12.82,-17.07,29.45,-1.16,-14.57
244,Citatah Tbk,CTTH,C121,Industrials,Industrial Goods,Building Products & Fixtures,Building Products & Fixtures,"COMPOSITE, DBX, IDXINDUST",-4.15,0.70,-16.90,-4.21,3.01,124314821921,88335407593,88.37,315.38,548.00,548.00,-33.92,76.09,523.08
245,PT Petrindo Jaya Kreasi Tbk,CUAN,A121,Energy,"Oil, Gas & Coal",Coal,Coal Production,"COMPOSITE, IDXENERGY, ISSI, MBX",125.17,30.13,24.07,6.02,3.00,301282652000000,13297297884000,16.06,78.17,-78.69,-68.77,18.10,-5.24,-78.56
246,ITSEC Asia Tbk.,CYBR,I121,Technology,Software & IT Services,IT Services & Consulting,IT Services & Consulting,"COMPOSITE, DBX, IDXSMC-COM, IDXTECHNO, ISSI",178.92,52.06,29.10,17.47,0.67,9715651767300,297235935699,0.37,31.88,33.17,301.47,18.27,-7.77,236.21
247,PT Daaz Bara Lestari Tbk,DAAZ,B146,Basic Materials,Basic Materials,Metals & Minerals,Diversified Metals & Minerals,"COMPOSITE, IDXBASIC, IDXSMC-COM, ISSI, MBX",13.33,2.16,16.18,5.68,1.85,4533190000000,9855700367527,0.89,-22.53,-45.69,-58.73,3.45,2.71,-53.00
248,Diamond Citra Propertindo Tbk,DADA,H111,Properties & Real Estate,Properties & Real Estate,Real Estate Management & Development,Real Estate Development & Management,"COMPOSITE, DBX, IDXPROPERT",206.98,1.05,0.51,0.28,0.82,371576540000,9050586919,0.00,-16.67,525.00,455.56,19.84,0.00,455.56
249,Duta Anggada Realty Tbk,DART,H111,Properties & Real Estate,Properties & Real Estate,Real Estate Management & Development,Real Estate Development & Management,"COMPOSITE, DBX, IDXPROPERT",-2.07,0.45,-21.68,-4.42,3.91,562308982198,370729103000,-7.85,12.10,19.73,-3.30,-73.12,-1.68,6.02
250,PT Remala Abadi Tbk,DATA,J311,Infrastructures,Telecommunication,Telecommunication Service,Wired Telecommunication Service,"COMPOSITE, DBX, IDXINFRA, IDXSMC-COM, ISSI",51.44,15.84,30.79,13.27,1.32,5610000000000,314434987716,-8.53,-16.40,206.23,425.79,34.68,3.98,450.00
251,Duta Intidaya Tbk,DAYA,D111,Consumer Non-Cyclicals,Food & Staples Retailing,Food & Staples Retailing,Drug Retail & Distributors,"COMPOSITE, DBX, IDXNONCYC, IDXSMC-COM, ISSI",52.86,32.95,62.33,6.82,8.14,3800258829250,2001384940000,-16.45,26.37,30.26,101.59,3.59,-4.87,81.43
252,DCI Indonesia Tbk,DCII,I121,Technology,Software & IT Services,IT Services & Consulting,IT Services & Consulting,"COMPOSITE, DBX, IDXTECHNO, ISSI",481.03,147.24,30.61,20.60,0.49,563755905350000,1922859000000,-6.62,-18.82,61.02,475.88,60.95,3.48,481.35
253,PT Dewata Freightinternational Tbk.,DEAL,K211,Transportation & Logistic,Logistics & Deliveries,Logistics & Deliveries,Logistics & Deliveries,"COMPOSITE, IDXTRANS",,-0.12,,-11.91,-3.64,6877025754,33365576103,0.00,0.00,0.00,0.00,-53.84,0.00,0.00
254,Danasupra Erapacific Tbk,DEFI,G211,Financials,Financing Service,Consumer Financing,Consumer Financing,"COMPOSITE, DBX, IDXFINANCE",-35.17,3.31,-9.42,-8.75,0.08,117522599886,5372982913,0.00,-51.14,-88.25,-88.25,-62.19,0.00,-88.25
255,Caturkarda Depo Bangunan Tbk,DEPO,E743,Consumer Cyclicals,Retailing,Specialty Retail,Home Improvement Retail,"COMPOSITE, DBX, IDXCYCLIC, IDXSMC-COM, ISSI",20.32,1.36,6.68,3.88,0.72,1806140000000,2105681819786,6.02,35.58,27.03,11.90,4.22,5.22,14.63
256,Darma Henwa Tbk,DEWA,A132,Energy,"Oil, Gas & Coal","Oil, Gas & Coal Supports","Oil, Gas & Coal Equipment & Services","COMPOSITE, IDXENERGY, IDXSMC-COM, ISSI, KOMPAS100, MBX",103.33,3.60,3.48,1.69,1.05,17576971593408,3108825999000,26.74,154.67,175.25,343.09,5.47,17.97,361.86
257,PT Dewi Shri Farmindo Tbk,DEWI,D231,Consumer Non-Cyclicals,Food & Beverage,Agricultural Products,"Fish, Meat, & Poultry","COMPOSITE, DBX, IDXNONCYC, ISSI",45.90,1.92,4.19,3.61,0.16,306000000000,46696941664,43.80,84.11,107.37,131.76,14.28,32.21,126.44
258,Dafam Property Indonesia Tbk,DFAM,E512,Consumer Cyclicals,Consumer Services,Tourism & Recreation,"Hotels, Resorts & Cruise Lines","COMPOSITE, DBX, IDXCYCLIC",-11.54,10.16,-88.03,-5.91,13.90,157687786550,44520179266,16.28,28.21,100.00,100.00,-30.70,17.65,100.00
259,Nusa Konstruksi Enjiniring  Tbk,DGIK,J211,Infrastructures,Heavy Constructions & Civil Engineering,Heavy Constructions & Civil Engineering,Heavy Constructions & Civil Engineering,"COMPOSITE, DBX, IDXINFRA, ISSI",10.92,0.93,8.52,4.27,1.00,664939800000,627562936241,18.02,39.36,67.95,65.82,9.70,9.17,63.75
260,PT Diagnos Laboratorium Utama Tbk,DGNS,F121,Healthcare,Healthcare Equipment & Providers,Healthcare Providers,Healthcare Providers,"COMPOSITE, DBX, IDXHEALTH, ISSI",-89.59,1.10,-1.23,-0.78,0.58,212500000000,118274283776,29.17,30.07,17.72,-13.89,-2.01,2.20,-5.58
261,PT Delta Giri Wacana Tbk,DGWG,B112,Basic Materials,Basic Materials,Chemicals,Agricultural Chemicals,"COMPOSITE, IDXBASIC, ISSI, MBX",11.96,2.21,18.47,5.41,2.41,2258823552000,2645272000000,-6.00,-6.93,-23.58,,7.14,-3.59,
262,Arkadia Digital Media Tbk,DIGI,E614,Consumer Cyclicals,Media & Entertainment,Media,Consumer Publishing,"COMPOSITE, IDXCYCLIC",91.74,-6.56,,4.27,-2.68,56875000000,27949472013,2.70,22.58,80.95,153.33,2.22,5.56,137.50
263,Intiland Development Tbk,DILD,H111,Properties & Real Estate,Properties & Real Estate,Real Estate Management & Development,Real Estate Development & Management,"COMPOSITE, IDXPROPERT, IDXSMC-COM, MBX",-15.19,0.21,-1.36,-0.68,1.00,1399390314975,1699679971167,-5.11,-4.41,-5.80,-23.53,-5.42,-2.99,-18.75
264,Distribusi Voucher Nusantara Tbk,DIVA,I111,Technology,Software & IT Services,Online Applications & Services,Online Applications & Services,"COMPOSITE, DBX, IDXTECHNO, ISSI",168.49,0.37,0.22,0.20,0.07,247142852200,2607103239452,-3.06,49.61,72.73,26.67,0.06,11.76,41.79
265,Central Omega Resources Tbk,DKFT,B146,Basic Materials,Basic Materials,Metals & Minerals,Diversified Metals & Minerals,"COMPOSITE, DBX, IDXBASIC, IDXSMC-COM, ISSI",7.77,3.26,42.04,17.43,1.41,4031346319000,1244510048622,-22.41,0.00,56.25,190.95,41.71,-6.25,218.40
266,PT Cipta Sarana Medika Tbk,DKHH,F121,Healthcare,Healthcare Equipment & Providers,Healthcare Providers,Healthcare Providers,"COMPOSITE, DBX, IDXHEALTH, ISSI",,1.07,,,0.67,214203524052,110909317904,0.00,-11.43,32.86,,,12.05,
267,Delta Djakarta Tbk,DLTA,D211,Consumer Non-Cyclicals,Food & Beverage,Beverages,Liquors,"COMPOSITE, IDXNONCYC, IDXSMC-COM, MBX",11.64,2.12,18.20,13.32,0.37,1649357643000,484192661000,-4.31,0.76,-11.50,-12.28,29.27,-1.96,-7.41
268,Puradelta Lestari Tbk,DMAS,H111,Properties & Real Estate,Properties & Real Estate,Real Estate Management & Development,Real Estate Development & Management,"COMPOSITE, ESGQKEHATI, ESGSKEHATI, IDXPROPERT, IDXSMC-COM, ISSI, MBX",8.58,1.00,11.60,10.90,0.06,6313952554100,779582858811,-2.26,-5.80,-9.09,-16.13,94.36,-0.76,-12.75
269,Digital Mediatama Maxima Tbk,DMMX,I121,Technology,Software & IT Services,IT Services & Consulting,IT Services & Consulting,"COMPOSITE, DBX, IDXSMC-COM, IDXTECHNO, ISSI",123.58,4.47,3.62,2.78,0.30,2923076926000,492011739885,10.33,4.10,3.57,72.03,4.81,9.73,67.77
270,Diamond Food Indonesia Tbk,DMND,D112,Consumer Non-Cyclicals,Food & Staples Retailing,Food & Staples Retailing,Food Retail & Distributors,"COMPOSITE, DBX, IDXNONCYC, IDXSMC-COM, ISSI",14.69,0.93,6.34,5.05,0.26,5965066170000,8052959000000,0.81,8.70,-18.30,-22.84,5.04,0.81,-21.88
271,PT Bank Oke Indonesia Tbk.,DNAR,G111,Financials,Banks,Banks,Banks,"COMPOSITE, DBX, IDXFINANCE, IDXSMC-COM",25.26,0.93,3.73,1.07,2.50,3508396792992,886788625386,69.35,73.55,89.19,61.54,15.82,5.53,90.91
272,PT Indoritel Makmur Internasional Tbk.,DNET,G512,Financials,Holding & Investment Companies,Holding & Investment Companies,Investment Companies,"COMPOSITE, IDXFINANCE, MBX",112.56,8.82,7.76,5.21,0.49,131202000000000,1221934000000,-0.84,-1.93,-7.31,-2.47,95.39,-1.93,-1.39
273,Delta Dunia Makmur Tbk,DOID,A132,Energy,"Oil, Gas & Coal","Oil, Gas & Coal Supports","Oil, Gas & Coal Equipment & Services","COMPOSITE, IDXENERGY, IDXSMC-COM, MBX",-1.24,1.54,-124.14,-7.79,14.93,2478926310768,18870543326856,-10.18,-15.73,-38.78,-52.38,-10.56,-5.06,-44.95
274,PT Era Media Sejahtera Tbk,DOOH,E611,Consumer Cyclicals,Media & Entertainment,Media,Advertising,"COMPOSITE, DBX, IDXCYCLIC, ISSI",632.75,7.46,1.18,0.87,0.36,1687078245848,73485275949,133.77,123.60,256.44,554.55,3.63,66.67,520.69
275,PT Global Sukses Digital Tbk,DOSS,E311,Consumer Cyclicals,Leisure Goods,Consumer Electronics,Consumer Electronics,"COMPOSITE, DBX, IDXCYCLIC, ISSI",11.02,1.65,15.02,9.76,0.54,312225000000,623909206848,59.76,46.37,49.71,10.08,4.54,35.75,38.62
276,Duta Pertiwi Nusantara Tbk,DPNS,B113,Basic Materials,Basic Materials,Chemicals,Specialty Chemicals,"COMPOSITE, DBX, IDXBASIC",12.35,0.30,2.46,2.41,0.02,102650285120,9456057432,0.00,-2.52,9.15,-6.63,87.93,0.00,-3.13
277,Dua Putra Utama Makmur Tbk,DPUM,D231,Consumer Non-Cyclicals,Food & Beverage,Agricultural Products,"Fish, Meat, & Poultry","COMPOSITE, DBX, IDXNONCYC",-9.91,0.93,-9.41,-3.11,2.02,367400000000,871877036617,60.29,57.97,118.00,62.69,-4.25,22.47,73.02
278,Dharma Polimetal Tbk,DRMA,E111,Consumer Cyclicals,Automobiles & Components,Auto Components,Auto Parts & Equipment,"COMPOSITE, ESGQKEHATI, ESGSKEHATI, IDXCYCLIC, IDXSMC-COM, ISSI, MBX",8.30,1.82,21.90,14.19,0.54,4870588180500,4392575987584,4.90,7.00,7.00,9.18,13.37,0.47,16.30
279,Dharma Samudera Fishing Industries Tbk,DSFI,D231,Consumer Non-Cyclicals,Food & Beverage,Agricultural Products,"Fish, Meat, & Poultry","COMPOSITE, DBX, IDXNONCYC, ISSI",10.52,0.57,5.43,3.23,0.68,159713653000,489077368786,18.18,28.40,76.27,85.71,3.10,23.81,82.46
280,PT Dharma Satya Nusantara Tbk.,DSNG,D232,Consumer Non-Cyclicals,Food & Beverage,Agricultural Products,Plantations & Crops,"BISNIS-27, COMPOSITE, ESGQKEHATI, ESGSKEHATI, IDX80, IDXG30, IDXNONCYC, IDXSHAGROW, IDXSMC-COM, IDXSMC-LIQ, IDXV30, IDXVESTA28, ISSI, JII70, KOMPAS100, MBX, SRI-KEHATI",11.24,1.64,14.59,9.29,0.57,17966732868000,8944918000000,-15.34,-17.86,71.43,30.81,17.87,-17.86,53.33
281,Dian Swastatika Sentosa Tbk,DSSA,A121,Energy,"Oil, Gas & Coal",Coal,Coal Production,"COMPOSITE, I-GRADE, IDX80, IDXENERGY, ISSI, KOMPAS100, LQ45, MBX",198.84,23.55,11.84,6.12,0.94,847222275840000,33706685170392,24.58,13.87,87.35,172.81,12.64,-2.84,193.83
282,Jaya Bersama Indo Tbk,DUCK,E515,Consumer Cyclicals,Consumer Services,Tourism & Recreation,Restaurants,"COMPOSITE, IDXCYCLIC",,0.24,4.46,3.06,0.46,225866080000,179775375019,0.00,0.00,0.00,0.00,22.89,0.00,0.00
283,Duta Pertiwi Tbk,DUTI,H111,Properties & Real Estate,Properties & Real Estate,Real Estate Management & Development,Real Estate Development & Management,"COMPOSITE, DBX, IDXPROPERT, IDXSMC-COM, ISSI",24.01,0.61,2.56,2.13,0.20,8177000000000,1696537425748,-5.31,-4.65,8.47,-16.67,20.07,-4.43,13.26
284,Darya-Varia Laboratoria Tbk,DVLA,F211,Healthcare,Pharmaceuticals & Health Care Research,Pharmaceuticals,Pharmaceuticals,"COMPOSITE, DBX, IDXHEALTH, IDXSMC-COM, ISSI",10.71,1.21,11.28,7.25,0.56,1853600000000,1628193562000,-0.60,2.48,-1.79,-0.90,10.63,0.00,3.13
285,Dwi Guna Laksana Tbk,DWGL,A122,Energy,"Oil, Gas & Coal",Coal,Coal Distribution,"COMPOSITE, DBX, IDXENERGY, IDXSMC-COM, ISSI",18.54,7.45,40.20,9.28,3.33,3108947852976,2545715201000,-12.07,33.04,21.43,10.87,6.59,-6.71,35.40
286,Dyandra Media International Tbk,DYAN,C224,Industrials,Industrial Services,Commercial Services,Business Support Services,"COMPOSITE, DBX, IDXINDUST, ISSI",7.20,0.51,7.06,4.25,0.66,376020856552,947754581005,-2.27,-2.27,-5.49,-6.52,5.51,0.00,-4.44
287,Eastparc Hotel Tbk,EAST,E512,Consumer Cyclicals,Consumer Services,Tourism & Recreation,"Hotels, Resorts & Cruise Lines","COMPOSITE, DBX, IDXCYCLIC, ISSI",11.85,0.81,6.85,6.55,0.05,383755696248,66954785798,1.06,1.06,-3.06,-17.39,48.36,2.15,-12.84
288,Electronic City Indonesia Tbk,ECII,E742,Consumer Cyclicals,Retailing,Specialty Retail,Electronics Retail,"COMPOSITE, DBX, IDXCYCLIC, ISSI",-9.93,0.22,-2.22,-1.55,0.43,246851605000,1663707936717,4.44,0.00,7.43,-37.75,-1.49,1.08,-27.13
289,Indointernet Tbk,EDGE,I121,Technology,Software & IT Services,IT Services & Consulting,IT Services & Consulting,"COMPOSITE, DBX, IDXSMC-COM, IDXTECHNO, ISSI",66.70,5.12,7.68,3.42,1.24,9171935000000,595113000000,4.10,10.12,16.88,16.58,23.11,-0.22,23.51
290,Ekadharma International Tbk,EKAD,B113,Basic Materials,Basic Materials,Chemicals,Specialty Chemicals,"COMPOSITE, DBX, IDXBASIC, ISSI",21.06,0.55,2.61,2.41,0.08,663836250000,393110036761,0.53,-1.05,0.00,-13.76,8.02,-1.05,-12.96
291,PT Data Sinergitama Jaya Tbk,ELIT,I121,Technology,Software & IT Services,IT Services & Consulting,IT Services & Consulting,"COMPOSITE, DBX, IDXTECHNO, ISSI",12.34,2.44,19.77,9.23,1.14,365695750260,352685245462,18.03,18.68,20.67,78.51,8.40,22.03,83.05
292,PT Pelayaran Nasional Ekalya Purnamasari Tbk,ELPI,K211,Transportation & Logistic,Logistics & Deliveries,Logistics & Deliveries,Logistics & Deliveries,"COMPOSITE, ESGSKEHATI, IDXSMC-COM, IDXTRANS, ISSI, MBX",19.77,2.34,11.81,9.59,0.23,5188400000000,760951000000,-2.10,98.86,98.86,87.17,34.48,2.94,97.74
293,Elnusa Tbk,ELSA,A131,Energy,"Oil, Gas & Coal","Oil, Gas & Coal Supports",Oil & Gas Drilling Service,"COMPOSITE, ESGSKEHATI, IDX80, IDXBUMN20, IDXENERGY, IDXMESBUMN, IDXSHAGROW, IDXSMC-COM, IDXSMC-LIQ, IDXV30, ISSI, JII70, KOMPAS100, MBX",5.35,0.72,13.39,6.80,0.97,3685742500000,10477387000000,-7.17,-2.57,2.93,6.03,6.58,-3.53,12.33
294,Bakrieland Development Tbk,ELTY,H111,Properties & Real Estate,Properties & Real Estate,Real Estate Management & Development,Real Estate Development & Management,"COMPOSITE, IDXPROPERT, ISSI",179.10,0.16,0.09,0.06,0.46,957482086418,1066573000000,62.50,160.00,290.00,178.57,0.50,62.50,254.55
295,PT Merdeka Gold Resources Tbk,EMAS,B143,Basic Materials,Basic Materials,Metals & Minerals,Gold,"COMPOSITE, DBX, IDXBASIC",-135.11,9.36,-6.93,-3.76,0.84,60352267877750,1893490404,11.66,,,,-23591.22,20.32,
296,Megapolitan Developments Tbk,EMDE,H111,Properties & Real Estate,Properties & Real Estate,Real Estate Management & Development,Real Estate Development & Management,"COMPOSITE, DBX, IDXPROPERT, ISSI",4.53,0.15,3.25,2.09,0.56,324950000000,123070652563,-5.83,-3.00,2.11,-24.22,58.26,0.00,-20.49
297,Elang Mahkota Teknologi Tbk,EMTK,I111,Technology,Software & IT Services,Online Applications & Services,Online Applications & Services,"COMPOSITE, ESGQKEHATI, ESGSKEHATI, IDX80, IDXESGL, IDXSHAGROW, IDXSMC-COM, IDXTECHNO, IDXV30, IDXVESTA28, ISSI, JII70, KOMPAS100, LQ45, MBX, SRI-KEHATI",10.08,1.38,13.69,12.23,0.12,75204895566675,13763091000000,9.13,12.70,141.23,125.41,54.23,13.64,161.90
